{"$schema":"https://json-schema.org/draft/2020-12/schema","$id":"https://fs-gg.github.io/schemas/evidence/qualification-inventories/v1","category":"qualification-inventories","type":"object","required":["compiler","dependencies","externalFixtures","generatedCases","independentCases","model","packages","results","reviewers","schema","sources"],"properties":{"compiler":{"$ref":"#/$defs/idSet"},"dependencies":{"$ref":"#/$defs/idSet"},"externalFixtures":{"$ref":"#/$defs/idSet"},"generatedCases":{"$ref":"#/$defs/idSet"},"independentCases":{"$ref":"#/$defs/idSet"},"model":{"$ref":"#/$defs/idSet"},"packages":{"$ref":"#/$defs/idSet"},"results":{"$ref":"#/$defs/idSet"},"reviewers":{"$ref":"#/$defs/idSet"},"schema":{"const":"fsgg.coordination.qualification-inventory/1"},"sources":{"$ref":"#/$defs/idSet"}},"additionalProperties":false,"$defs":{"idSet":{"type":"array","minItems":1,"uniqueItems":true,"items":{"type":"string","pattern":"^[A-Za-z0-9][A-Za-z0-9._-]{0,127}$"}}}}
