{"compiler":["compiler-binary"],"dependencies":["locked-dependencies"],"externalFixtures":["external-fixtures"],"generatedCases":["generated-cases"],"independentCases":["independent-cases"],"model":["protocol-model"],"packages":["candidate-packages"],"results":["result-q1","result-q2","result-q7"],"reviewers":["review-architecture"],"schema":"fsgg.coordination.qualification-inventory/1","sources":["source-tree"]}
